{"id":"margin-0.3.2-agent-recovery-v20","manual_sha256":"d6338f259dd64e81b12a4a1344b4d7275381e09178eed81fd3d39b5b8aba9803","margin_sha256":"226ca821523802813f77975f2bb9c9f1c9ac8c6424665dcb90c6db61aa10f7e1","schema":"urn:marginbench:candidate:v1","settings":{"adapter":"prime-verifiers-v1","benchmarkVersion":"0.2.0-crossover","change":"atomic-reply-guidance-and-executable-stage-recovery","toolSurface":["margin"]},"settings_sha256":"faf865329bd89ec8202e0f0227e97b66720289f825cb8b24697a46c9497585fa"}
