{
  "id": "single-read-handoff-guidance-v3",
  "manual_sha256": "5739e8e4f6da78091d14589f6674fd2928216b1199ea9e523a7073a8cd34909f",
  "margin_sha256": "c220c0d61de8d523a2d55e1226693acda7ee909e2d518cc25572737965d2c57e",
  "schema": "urn:marginbench:candidate:v1",
  "settings": {
    "adapter": "prime-verifiers-v1",
    "benchmarkVersion": "0.1.0",
    "controlProfile": "role-separated-margin-only-v1",
    "gatewayAdapterSha256": "d80b8d12c4ec94bc6099bca86a25e70b9116d4f9c7cd7cec522c43c3f51bb62b",
    "gatewayPolicySha256": "06cdc57ae0d60bea5915465466f027ebe7c83e9df0fc0907354bcb72dc7a1293",
    "scenarioProtocolSha256": "035b4ab7b0875f66aaeb5cfafab58b355cd280d65ab0d791993faf37efac857e",
    "toolSurface": [
      "margin"
    ]
  },
  "settings_sha256": "7aa114edc53f904a5cc7e77cb24b0d133a2d5fab1ede1f009cb672cb20aab6d5"
}
