{"id":"margin-0.3.2-structured-manual-v17","manual_sha256":"5b7a8988983fd648ab475074952cde34820068ab643b8cc68693adb8dac47c1f","margin_sha256":"63896b7b5afda0691a8c7855e50f9b989cd7b519eb15e51713cf1096175f7964","schema":"urn:marginbench:candidate:v1","settings":{"adapter":"prime-verifiers-v1","benchmarkVersion":"0.1.0","change":"structured-progressive-manual-and-exact-revision-semantics","toolSurface":["margin"]},"settings_sha256":"8def2e04b50429caa790f81df7e86ecd377965d84ce5d358740764cdefa20ee8"}
